{
  "schema_version": "1.0",
  "factory_version": "1.0.0",
  "generated_at": "2026-08-19T16:10:00+03:00",
  "operating_mode": "REPOSITORY_PLUS_BRIEF",
  "project_name": "Yad2 Car Finder Bot",
  "workflow_entry_skill": "feature-intake",
  "agents": [
    "workflow_triage",
    "architect",
    "validation_planner",
    "planner"
  ],
  "rules": [
    "01-project-core",
    "02-architecture-and-planning",
    "03-validation-and-doc-update",
    "04-feature-intake-workflow"
  ],
  "factory_owned_files": [
    {
      "path": ".cursor/agents/architect.md",
      "role": "agent",
      "evidence": ["E-004", "E-006", "E-008", "E-009", "E-012", "E-016"],
      "sha256": "256f141b90692a114cd2c90b154fe2872242d8ff098136fb7d8b22c1187b1f2e"
    },
    {
      "path": ".cursor/agents/planner.md",
      "role": "agent",
      "evidence": ["E-001", "E-002", "E-023"],
      "sha256": "aafc23d3e85e49cb3a1d308afb661912c4c8642ec5a9afb772ebe5ff8cbe1b81"
    },
    {
      "path": ".cursor/agents/validation_planner.md",
      "role": "agent",
      "evidence": ["E-001", "E-008", "E-009", "E-011", "E-013", "E-016", "E-023"],
      "sha256": "96093880fc7c11f4d92b017a3b95b57a9ba5055d1db3fbb5ad0000632b2e0e89"
    },
    {
      "path": ".cursor/agents/workflow_triage.md",
      "role": "agent",
      "evidence": ["E-001", "E-004", "E-005", "E-008"],
      "sha256": "ff5d5dc58f0e21863a40c07ae27196331f281bfa3d13e907333a026ee2d790c7"
    },
    {
      "path": ".cursor/rules/01-project-core.mdc",
      "role": "rule",
      "evidence": ["E-001", "E-002", "E-005", "E-008", "E-013"],
      "sha256": "bbb9c8069ff2def24f1c2b0ed13b240190a9576cde45ad67cde1c94eadc57025"
    },
    {
      "path": ".cursor/rules/02-architecture-and-planning.mdc",
      "role": "rule",
      "evidence": ["E-004", "E-006", "E-009", "E-012", "E-016", "E-022"],
      "sha256": "5d164a24046d87e8d82e337124c64067f79dfc77a79ed8b0c1a7d3071dca2610"
    },
    {
      "path": ".cursor/rules/03-validation-and-doc-update.mdc",
      "role": "rule",
      "evidence": ["E-001", "E-002", "E-021", "E-022", "E-023"],
      "sha256": "21af18440faa5502bc30cb90d54c749e3d36b8ac8e41d7c08cfe8f0eec56d8dd"
    },
    {
      "path": ".cursor/rules/04-feature-intake-workflow.mdc",
      "role": "rule",
      "evidence": ["framework_specification.md"],
      "sha256": "298e2c959dd3c73d4ea6c6b62515ea00604934dd590ca80255910378338ee136"
    },
    {
      "path": ".cursor/skills/feature-intake/SKILL.md",
      "role": "workflow-skill",
      "evidence": ["E-001", "framework_specification.md"],
      "sha256": "02b845fc12d7b1d7f46b0067b18154a9e9586e3df8b8c894eb992e03668dde0d"
    },
    {
      "path": ".cursor/skills/feature-intake/references/architect-handoff-template.md",
      "role": "skill-reference",
      "evidence": ["framework_specification.md"],
      "sha256": "ec6040767a79ad3ba327aa5efb7ef2934799d38d0092844984736f91d143c7b4"
    },
    {
      "path": ".cursor/skills/feature-intake/references/collection-evidence-template.md",
      "role": "skill-reference",
      "evidence": ["E-001", "E-008", "E-009"],
      "sha256": "1bbc96f16e3fd98f000265bdc0f537297787a97bd3ab2cee99adc35ff14c6b89"
    },
    {
      "path": ".cursor/skills/feature-intake/references/final-packet-template.md",
      "role": "skill-reference",
      "evidence": ["framework_specification.md"],
      "sha256": "7e512c7ad77f8a9b1736238092b3f2bcab12febb5832bc1b697ee831f8a3eeb5"
    },
    {
      "path": ".cursor/skills/feature-intake/references/planner-handoff-template.md",
      "role": "skill-reference",
      "evidence": ["framework_specification.md"],
      "sha256": "16f6a999c2248957cb0237b7178b9b092060ef16ad9956e427bd0cdf8248f34f"
    },
    {
      "path": ".cursor/skills/feature-intake/references/task-brief-template.md",
      "role": "skill-reference",
      "evidence": ["framework_specification.md"],
      "sha256": "9571d1f83fd65042e4914327725374b0e01c3ca1a089c5ac9099f14aa0b81688"
    },
    {
      "path": ".cursor/skills/feature-intake/references/validation-gate-template.md",
      "role": "skill-reference",
      "evidence": ["framework_specification.md"],
      "sha256": "a8305a4f64803ad9157b043b9f7179ad35a30fe29147e85fcd2aef659cbfcd42"
    },
    {
      "path": ".cursor/skills/feature-intake/references/workflow-state-template.md",
      "role": "skill-reference",
      "evidence": ["framework_specification.md"],
      "sha256": "2e37d655dafd0ab0c5cec2bbccc698cad97d5210d604ce61a9c06a5222c62678"
    }
  ],
  "preserved_files": [
    ".claude/settings.local.json"
  ],
  "conflicts": [],
  "to_verify": [
    "Confirm Cursor accepts agent frontmatter tools: Read, Grep, Glob and discovers .cursor/skills/feature-intake without extra wiring.",
    "Confirm no external CI job should be named in the validation matrix.",
    "Live Yad2 markup was not re-fetched in this factory run; last documented live proof remains PROJECT_STATUS.md 2026-08-15 (34 cards).",
    "Operator Chrome path in PROJECT_STATUS.md is macOS-specific; Playwright channel default is chrome."
  ]
}
